<?xml version="1.0" encoding="UTF-8"?>
<Order created="2010-10-10T10:30:00" 
		xmlns="http://www.medeos.org/v1.0.0"
		xmlns:xml="http://www.w3.org/XML/1998/namespace"
		xmlns:xsi="http://www.w3.org/2001/XMLSchema-instance"
		xsi:schemaLocation="http://www.medeos.org/v1.0.0 file://medeos_v1_0.xsd">
	<Sender>
		<UnitName>
			Example Hospital no. 1
		</UnitName>
		<StationName>
			Example Station no. 1
		</StationName>
		<Person>
			<FamilyName>Kowalski</FamilyName>
			<GivenName>Jan</GivenName>
			<Licence>A12-3456</Licence>
			<Contact>jan.kowalski@example.com</Contact>
		</Person>
	</Sender>
	<Receiver>
		<UnitName>
			Example Hospital no. 2
		</UnitName>
		<StationName>
			Example Station no. 1
		</StationName>
	</Receiver>
	<Patient id="1990123456789" idType="pesel">
		<FamilyName>Nowak</FamilyName>
		<GivenName>Zbigniew</GivenName>
		<MiddleName>Jan</MiddleName>
		<Sex>male</Sex>
		<Age>21Y</Age>
		<DateOfBirth>1990-10-10</DateOfBirth>
	</Patient>
	<RequestedService id="MR" priority="normal">
		<ExaminationTime>2010-10-10T10:00:00</ExaminationTime>
		<Description xml:lang="en">Examination description.</Description>
		<Description xml:lang="pl">Opis badania.</Description>
		<Problem xml:lang="en">What should be done.</Problem>
		<Problem xml:lang="pl">Opis problemu do opisania.</Problem>
		<Comment xml:lang="en">Any comments</Comment>
		<Comment xml:lang="pl">Dodatkowe komentarze</Comment>
	</RequestedService>
	<Attachments>
		<File name="image1.dicom" sha256="a9b43d25b0916619259..."/> 
		<File name="image2.dicom" sha256="9233b480c5faba2460c..."/>
	</Attachments>
</Order>
